{
  "protocol_version": "retained-provider.config.v1",
  "worker_id": "github-runner-linux-stg",
  "profile_id": "github-runner-profile-stg",
  "plugin_id": "workflow-plugin-github",
  "component_id": "github-runner-provider-sidecar",
  "compute_agent_path": "/home/wfcompute/.workflow-compute/agent-core-bin/github-runner-linux-stg/compute-agent",
  "supervisor_config_path": "/home/wfcompute/.workflow-compute/github-runner-linux-stg/supervisor.pb",
  "local_status_path": "/home/wfcompute/.workflow-compute/github-runner-linux-stg/agent-status.json",
  "provider_marker_path": "/home/wfcompute/.workflow-compute/updates/updates/current/provider-workflow-plugin-github--component-Z2l0aHViLXJ1bm5lci1wcm92aWRlci1zaWRlY2Fy.json",
  "install_root": "/home/wfcompute/.workflow-compute/github-runner-provider",
  "systemd_dir": "/home/wfcompute/.config/systemd/user",
  "agent_unit": "workflow-compute-github-runner-linux-stg.service",
  "podman_path": "/usr/bin/podman",
  "systemctl_path": "/usr/bin/systemctl",
  "loginctl_path": "/usr/bin/loginctl",
  "provider_url": "https://workflow-plugin-github-runner-provider:18090",
  "stable_container": "workflow-plugin-github-runner-provider",
  "candidate_container": "workflow-plugin-github-runner-provider-candidate",
  "container_network": "wfcompute-github-provider",
  "organization": "GoCodeAlone",
  "repository": "GoCodeAlone/workflow-compute",
  "workflow": "dogfood-provider-target.yml",
  "ref": "aaaaaaaaaaaaaaaaaaaaaaaaaaaaaaaaaaaaaaaa",
  "runner_name": "wfc-stg-ghp-linux-probe",
  "runner_group": "ephemeral",
  "labels": ["self-hosted", "linux", "wfc-ghp-stg"],
  "refresh_interval_seconds": 300
}
